{
  "name": "side_note_left",
  "meta": {
    "feature": "kunten",
    "level": "should",
    "spec_section": "6.5",
    "note": "[provenance:hand-derived §6.5 + AOZORA-ANNOTATION 2026-06-17] Left-side annotation (注記): the 「未来」 target precedes the directive (pulled back) and the の注記 keyword yields a sideNote node, distinct from a ruby. Promoted from the §10.5 deferred list now that §6.5 pins it normatively."
  },
  "source": "未来［＃「未来」の左に「みらい」の注記］を見る。\n",
  "expected": {
    "html": "<p><ruby>未来<rp>(</rp><rt class=\"aozora-margin-note\">みらい</rt><rp>)</rp></ruby>を見る。</p>\n",
    "serialize": "未来［＃「未来」の左に「みらい」の注記］を見る。\n",
    "nodes": [
      {
        "kind": "marginNote",
        "span": {
          "start": 0,
          "end": 60
        }
      }
    ],
    "pairs": [
      {
        "kind": "quote",
        "open": {
          "start": 12,
          "end": 15
        },
        "close": {
          "start": 21,
          "end": 24
        }
      },
      {
        "kind": "quote",
        "open": {
          "start": 33,
          "end": 36
        },
        "close": {
          "start": 45,
          "end": 48
        }
      },
      {
        "kind": "bracket",
        "open": {
          "start": 6,
          "end": 9
        },
        "close": {
          "start": 57,
          "end": 60
        }
      }
    ],
    "diagnostics": []
  }
}
