{
  "name": "break_in_single_line_container",
  "meta": {
    "feature": "break",
    "level": "should",
    "spec_section": "6.9",
    "note": "[provenance:hand-derived §6.9 + AOZORA-ANNOTATION 2026-06-17] A page break inside a single-line 地付き marker is ill-formed and raises break-in-single-line-container (warning, §9). Offsets from the §3 byte model; not read back from a processor."
  },
  "source": "［＃地付き］本文［＃改ページ］",
  "expected": {
    "html": "<p><span class=\"aozora-align-end\" data-offset=\"0\"></span>本文</p>\n<div class=\"aozora-page-break\"></div>",
    "serialize": "［＃地付き］本文\n\n［＃改ページ］\n\n",
    "nodes": [
      {
        "kind": "alignEnd",
        "span": {
          "start": 0,
          "end": 18
        }
      },
      {
        "kind": "pageBreak",
        "span": {
          "start": 24,
          "end": 45
        }
      }
    ],
    "pairs": [
      {
        "kind": "bracket",
        "open": {
          "start": 0,
          "end": 3
        },
        "close": {
          "start": 15,
          "end": 18
        }
      },
      {
        "kind": "bracket",
        "open": {
          "start": 24,
          "end": 27
        },
        "close": {
          "start": 42,
          "end": 45
        }
      }
    ],
    "diagnostics": [
      {
        "code": "break-in-single-line-container",
        "severity": "warning",
        "span": {
          "start": 24,
          "end": 45
        }
      }
    ]
  }
}
