{
  "name": "bold_forward",
  "meta": {
    "feature": "emphasis",
    "level": "should",
    "spec_section": "6.12",
    "note": "[provenance:hand-derived §6.12 + AOZORA-ANNOTATION 2026-06-17] Forward-reference ［＃「X」は太字］ bolds the most recent preceding X (§7.5), rendering <b>. Offsets from the §3 byte model; not read back from a processor."
  },
  "source": "作者附記［＃「作者附記」は太字］――以下略。\n",
  "expected": {
    "html": "<p><b class=\"aozora-futoji\">作者附記</b>――以下略。</p>\n",
    "serialize": "作者附記［＃「作者附記」は太字］――以下略。\n",
    "nodes": [
      {
        "kind": "emphasis",
        "span": {
          "start": 0,
          "end": 48
        }
      }
    ],
    "pairs": [
      {
        "kind": "quote",
        "open": {
          "start": 18,
          "end": 21
        },
        "close": {
          "start": 33,
          "end": 36
        }
      },
      {
        "kind": "bracket",
        "open": {
          "start": 12,
          "end": 15
        },
        "close": {
          "start": 45,
          "end": 48
        }
      }
    ],
    "diagnostics": []
  }
}
