{
  "name": "ruby_implicit",
  "meta": {
    "feature": "ruby",
    "level": "must",
    "spec_section": "6.1",
    "note": "[provenance:hand-derived §6.1 + AOZORA-ANNOTATION 2026-06-17] With no ｜ marker the base is the maximal preceding run of the same character class (青梅); html is <ruby>. Offsets from the §3 byte model. Serialize canonicalises right-side ruby to the BARE form (the explicit ｜ is dropped) per ADR 0003 §6.1 / ADR 0002: ｜ is emitted only when a bare 《reading》 would re-parse to a different base; here every base is an all-kanji run whose preceding char is non-base (line start / 　 / の), so the bare form re-parses identically."
  },
  "source": "青梅《おうめ》という地名。\n",
  "expected": {
    "html": "<p><ruby>青梅<rp>(</rp><rt>おうめ</rt><rp>)</rp></ruby>という地名。</p>\n",
    "serialize": "青梅《おうめ》という地名。\n",
    "nodes": [
      {
        "kind": "ruby",
        "span": {
          "start": 0,
          "end": 21
        }
      }
    ],
    "pairs": [
      {
        "kind": "ruby",
        "open": {
          "start": 6,
          "end": 9
        },
        "close": {
          "start": 18,
          "end": 21
        }
      }
    ],
    "diagnostics": []
  }
}
