{
  "name": "line_font_size_single",
  "meta": {
    "feature": "layout",
    "level": "should",
    "spec_section": "6.6",
    "note": "[provenance:hand-derived §6.6 + AOZORA-ANNOTATION 2026-07-01] ［＃大文字］ is a single-line absolute-font-size marker (the postfix headline form, §6.17 scale 特大>大>中>本文>小), governing the rest of its line — a zero-width marker node like この行はゴシック体, not a wrapping container. §8 renders <span class=\"aozora-line-font-large\"></span>. Corpus: one work (暗黒公使) with an in-text editor note defining the 4-level scheme; 47 postfix occurrences. Offsets from the §4 byte model."
  },
  "source": "見出し行［＃大文字］\n",
  "expected": {
    "html": "<p>見出し行<span class=\"aozora-line-font-large\"></span></p>\n",
    "serialize": "見出し行［＃大文字］\n",
    "nodes": [
      {
        "kind": "lineFontSize",
        "span": {
          "start": 12,
          "end": 30
        }
      }
    ],
    "pairs": [
      {
        "kind": "bracket",
        "open": {
          "start": 12,
          "end": 15
        },
        "close": {
          "start": 27,
          "end": 30
        }
      }
    ],
    "diagnostics": []
  }
}
