{
  "name": "line_width_container",
  "meta": {
    "feature": "container",
    "level": "must",
    "spec_section": "6.6",
    "note": "[provenance:hand-derived §6.6 + AOZORA-ANNOTATION 2026-06-17] ［＃ここからN字詰め］ sets a fixed N full-width characters per line for the enclosed block, closing with 字詰め終わり. Offsets from the §3 byte model."
  },
  "source": "本文。\n［＃ここから26字詰め］\n詰めた段落。\n別の行。\n［＃ここで字詰め終わり］\n通常段落。\n",
  "expected": {
    "html": "<p>本文。</p>\n<div class=\"aozora-container aozora-container-line-width\" data-width=\"26\">\n<p>詰めた段落。<br />\n別の行。</p>\n</div>\n<p>通常段落。</p>\n",
    "serialize": "本文。\n\n［＃ここから26字詰め］\n\n詰めた段落。\n別の行。\n\n［＃ここで字詰め終わり］\n\n通常段落。\n",
    "nodes": [
      {
        "kind": "containerOpen",
        "span": {
          "start": 10,
          "end": 42
        }
      },
      {
        "kind": "containerClose",
        "span": {
          "start": 75,
          "end": 111
        }
      }
    ],
    "pairs": [
      {
        "kind": "bracket",
        "open": {
          "start": 10,
          "end": 13
        },
        "close": {
          "start": 39,
          "end": 42
        }
      },
      {
        "kind": "bracket",
        "open": {
          "start": 75,
          "end": 78
        },
        "close": {
          "start": 108,
          "end": 111
        }
      }
    ],
    "diagnostics": []
  }
}
