{
  "name": "sashie",
  "meta": {
    "feature": "sashie",
    "level": "must",
    "spec_section": "6.11",
    "note": "[provenance:hand-derived §6.11 + AOZORA-ANNOTATION 2026-06-17] The informative reference html is the figure/img form; an earlier draft carried a bare <!-- aozora_sashie --> comment placeholder. The normative nodes / pairs are unchanged."
  },
  "source": "ある日、［＃挿絵（cover.png）入る］その地に至る。\n",
  "expected": {
    "html": "<p>ある日、</p>\n<figure class=\"aozora-illustration\"><img src=\"cover.png\" alt=\"\" /></figure>\n<p>その地に至る。</p>\n",
    "serialize": "ある日、\n\n［＃挿絵（cover.png）入る］\n\nその地に至る。\n",
    "nodes": [
      {
        "kind": "illustration",
        "span": {
          "start": 12,
          "end": 48
        }
      }
    ],
    "pairs": [
      {
        "kind": "bracket",
        "open": {
          "start": 12,
          "end": 15
        },
        "close": {
          "start": 45,
          "end": 48
        }
      }
    ],
    "diagnostics": []
  }
}
